{
  "version": 1,
  "_note": "Synthetic client record (B-13 example). Fabrikam Capital is invented.",
  "id": "fabrikam-capital",
  "display_name": "Fabrikam Capital (synthetic)",
  "psa_company_id": "29684002",
  "industry": "ria",
  "regimes": [
    "glba-ftc-safeguards",
    "sec-reg-s-p"
  ],
  "model_processing": "none",
  "retention_class": "regulated-financial",
  "vault": "shared",
  "enabled_levers": [
    "ticket.get",
    "kb.search",
    "user.reset-mfa"
  ],
  "enabled_jobs": [
    {
      "job": "baseline.m365",
      "schedule": "weekly@06:00"
    }
  ],
  "bindings": {
    "psa": {
      "implementation": "mock",
      "external_id": "29684002"
    },
    "m365": {
      "implementation": "mock",
      "external_id": "f0000000-0000-4000-8000-000000000001",
      "access": "gdap",
      "credential_ref": "client-fabrikam-capital-graph"
    }
  }
}
